Budget Constraints,Target Audience,Goals,Allocated Budget Distribution,Response Text
5.0,Environmentally conscious millennials,Brand Awareness,"Allocate $2,000 for influencer partnerships, $1,500 for targeted ads, and $1,500 for content creation","""Revolutionize Your Wardrobe"" campaign, leveraging Instagram and TikTok influencers to showcase eco-friendly fashion. Collaborate with 5 influencers for sponsored content, utilizing hashtags #SustainabilityInFashion and #GreenCycleClothing. Allocate $2,000 for influencer partnerships, $1,500 for targeted ads, and $1,500 for content creation. Monitor engagement and adjust ad spend accordingly."
2.0,Business owners and IT professionals,Website Traffic,"Allocate Mondays for ""Myth-Busting Mondays"" and Thursdays for ""Throwback Thursdays,"" highlighting past successes","""AI Insights"" series, covering topics like AI adoption, ML applications, and industry trends. Allocate Mondays for ""Myth-Busting Mondays"" and Thursdays for ""Throwback Thursdays,"" highlighting past successes. Utilize SEO keywords, meta descriptions, and optimize images. Schedule 8 articles per month, with 2 in-depth guides and 2 listicles."
20.0,"18-25-year-olds; Constraints: Limited budget; Goals: 20% increase in followers, 15% increase in website traffic; Workflow Stage: Strategy",Website Traffic,Allocate 30% of the budget to Instagram Reels and TikTok ads targeting the specified age group,"Develop a social media contest, ""Eco-Chic Challenge,"" where followers share their eco-friendly fashion tips using a branded hashtag. Partner with eco-influencers to promote the contest. Allocate 30% of the budget to Instagram Reels and TikTok ads targeting the specified age group. Create engaging content (images, videos, and captions) highlighting GreenThreads' commitment to sustainability."
5.0,"Gen Z (18-24 years old); Constraints: Limited budget ($5,000); Goals: Increase brand awareness by 30% in 6 weeks; Workflow Stage: Strategy.",Brand Awareness,"Allocate $2,000 for influencer partnerships, $1,500 for sponsored posts, and $1,500 for prize giveaways","Launch a social media contest, ""Green Revolution,"" where followers share eco-friendly fashion tips using a branded hashtag. Collaborate with 5 eco-influencers to promote the contest. Allocate $2,000 for influencer partnerships, $1,500 for sponsored posts, and $1,500 for prize giveaways."
1.0,Gen Z (18-24 years old),Engagement,Allocate $500 for influencer collaborations and $500 for paid social media ads,"Launch a ""Sustainable Fashion Challenge"" on TikTok and Instagram, encouraging users to share their eco-friendly fashion choices using a branded hashtag. Partner with 5 eco-influencers to promote the challenge and create engaging content. Allocate $500 for influencer collaborations and $500 for paid social media ads."
5.0,Environmentally conscious consumers aged 25-45,Brand Awareness,"Allocate $2,000 for sponsored content, $1,500 for influencer collaborations, and $1,500 for content creation","Launch a 6-week social media campaign across Facebook, Instagram, and Twitter, focusing on engaging visuals and influencer partnerships. Allocate $2,000 for sponsored content, $1,500 for influencer collaborations, and $1,500 for content creation. Utilize relevant hashtags and tag eco-conscious influencers to amplify reach."
1.0,Young adults (18-30) interested in eco-friendly products,Brand Awareness,Allocate $500 for influencer partnerships and $500 for sponsored ads,"Launch a social media contest, ""Eco-Chic Challenge,"" where followers share their own sustainable fashion tips and tricks using a branded hashtag. Partner with eco-influencers to amplify the campaign. Allocate $500 for influencer partnerships and $500 for sponsored ads."
5.0,Millennials aged 25-35 who prioritize sustainability,Brand Awareness,"Allocate $2,000 for influencer partnerships, $1,500 for ad spend, and $1,500 for content creation","Launch a social media contest, ""Share Your Green Moment,"" where followers share photos of themselves using Hydrate Green water bottles in eco-friendly settings. Partner with 5 eco-influencers to promote the contest and offer a 20% discount code for participants. Allocate $2,000 for influencer partnerships, $1,500 for ad spend, and $1,500 for content creation."
3.0,Gen Z aged 18-24 who value individuality,Brand Awareness,"Allocate $1,500 for influencer partnerships, $1,000 for ad spend,","Launch a ""Vibez Challenge"" Instagram campaign featuring bold, eye-catching graphics and videos showcasing the brand's eclectic clothing line. Partner with 3 emerging artists to create exclusive designs and offer a 15% discount code for participants. Utilize Instagram Reels and IGTV to share behind-the-scenes content, sneak peeks, and user-generated content. Allocate $1,500 for influencer partnerships, $1,000 for ad spend,"
5.0,Environmentally conscious individuals aged 18-30.,Website Traffic,"Allocate $2,000 for influencer collaborations and $1,500 for content creation and advertising","Develop a social media campaign, ""Eco-Chic Revolution,"" focusing on Instagram and TikTok. Partner with 5 eco-influencers to showcase GreenStyle's sustainable clothing. Create engaging content (images, videos, and Reels) highlighting the brand's commitment to reducing waste and carbon footprint. Utilize relevant hashtags, such as #ecofashion and #sustainability, to increase visibility. Allocate $2,000 for influencer collaborations and $1,500 for content creation and advertising."
5.0,"Gen Z (18-24 years old); Constraints: Limited budget of $5,000; Goals: Increase brand awareness by 20% in 6 weeks; Workflow Stage: Strategy.",Brand Awareness,"Allocate $2,000 for influencer partnerships, $1,500 for content creation, and $1,500 for social media advertising","""Verde Vibes"" campaign: Partner with eco-influencers to showcase Verde's sustainable clothing lines. Create engaging content (images, videos, and Reels) highlighting the brand's commitment to sustainability. Allocate $2,000 for influencer partnerships, $1,500 for content creation, and $1,500 for social media advertising. Utilize Instagram, TikTok, and Facebook to reach the target audience."
5.0,"18-25-year-olds active on Instagram, TikTok, and Facebook. Constraints: Limited budget of $5,000. Goals: Increase followers by 20% and drive website traffic by 30%. Workflow Stage: Strategy.",Website Traffic,"Allocate $2,000 for influencer partnerships, $1,500 for sponsored ads, and $1,000 for content creation","""GreenThreads Challenge"" - a social media campaign encouraging users to share their own eco-friendly fashion tips and tricks using a branded hashtag. Partner with influencers and offer a discount code to participants. Allocate $2,000 for influencer partnerships, $1,500 for sponsored ads, and $1,000 for content creation."
1.0,Gen Z (18-24 years old),Brand Awareness,"Allocate $300 for influencer partnerships, $200 for paid social media ads, and $500 for content creation","""Threads for a Greener Tomorrow"" campaign, leveraging Instagram Reels, TikTok, and Pinterest to showcase eco-friendly fashion. Partner with 3 eco-influencers for sponsored content, utilizing hashtags #SustainableFashion and #EcoWarriors. Allocate $300 for influencer partnerships, $200 for paid social media ads, and $500 for content creation. Track engagement and website traffic using Google Analytics."
5.0,"Generation Z (18-24 years old) who prioritize sustainability and fashion. Constraints: Limited budget of $5,000. Goals: Increase brand awareness by 20% and drive sales by 15% within 6 weeks. Workflow Stage: Strategy.",Brand Awareness,"Allocate $2,000 for influencer fees, $1,500 for sponsored ads, and $1,500 for content creation and campaign management","Create a social media campaign leveraging Instagram and TikTok, focusing on user-generated content (UGC) and influencer partnerships. Partner with 5 eco-conscious influencers to showcase Verde Fashion's products in their daily lives. Launch a hashtag challenge, encouraging followers to share their own sustainable fashion choices, with a chance to win a free Verde Fashion item. Allocate $2,000 for influencer fees, $1,500 for sponsored ads, and $1,500 for content creation and campaign management."
1.0,"Gen Z (18-24 years old); Constraints: Limited budget of $1,000; Goals: Increase brand awareness by 20% and drive website traffic by 15%; Workflow Stage: Strategy Development.",Brand Awareness,"Allocate $300 for influencer partnerships, $200 for content creation, and $500 for paid social media ads targeting Gen Z","Develop a social media campaign, ""Eco-Cycle,"" focusing on Instagram and TikTok. Collaborate with 5 eco-influencers to showcase sustainable fashion practices and encourage users to share their own eco-friendly fashion choices. Utilize Instagram Reels and TikTok's ""Reaction"" feature to create engaging, interactive content. Allocate $300 for influencer partnerships, $200 for content creation, and $500 for paid social media ads targeting Gen Z."
20.0,"Gen Z consumers (18-24 years old); Constraints: Limited budget, high competition in the sustainable fashion market; Goals: Increase brand awareness by 20%, drive sales by 15% in 6 months; Workflow Stage: Strategy.",Brand Awareness,"Allocate $5,000 for paid ads targeting Gen Z interests and hashtags","Develop a social media campaign, ""Verde Vibes,"" focusing on Instagram and TikTok, highlighting eco-friendly materials, diverse models, and inclusive messaging. Collaborate with 5 eco-conscious influencers for sponsored content and product showcases. Allocate $5,000 for paid ads targeting Gen Z interests and hashtags. Share behind-the-scenes content, customer testimonials, and educational posts on sustainable fashion. Monitor engagement and adjust the campaign using AI-driven analytics."
50.0,"IT professionals and decision-makers; Constraints: Limited content creation resources, high competition on LinkedIn; Goals: Increase engagement by 50%, drive 20% more website traffic in 4 months; Workflow Stage: Post Scheduling.",Website Traffic,Allocate 2 posts per week: 1 in-depth article on Tuesdays and 1 engaging video on Thursdays,"Create a content calendar focusing on thought leadership, industry trends, and product showcases. Allocate 2 posts per week: 1 in-depth article on Tuesdays and 1 engaging video on Thursdays. Utilize LinkedIn's publishing platform for long-form content and collaborate with industry influencers for guest posts. Share customer success stories, whitepapers, and webinars to establish TechSoft as a trusted authority."
5.0,Young adults (18-35) interested in eco-friendly living,Brand Awareness,"Allocate $2,000 for influencer collaborations, $1,500 for paid social media ads, and $1,500 for content creation","Launch a social media contest, ""GreenThreads Challenge,"" where followers share their favorite eco-friendly fashion tips using a branded hashtag. Partner with eco-influencers to promote the contest and create engaging content (images, videos, and blog posts) highlighting GreenThreads' sustainable practices. Allocate $2,000 for influencer collaborations, $1,500 for paid social media ads, and $1,500 for content creation."
10.0,Health-conscious women (25-45) interested in vegan living,Brand Awareness,"Allocate $5,000 for influencer collaborations, $3,000 for product seeding, and $2,000 for Instagram ads","Partner with 10 vegan influencers to create sponsored content featuring PureGlow products. Request that influencers share their personal experiences, tips, and favorite products, using a branded hashtag. Allocate $5,000 for influencer collaborations, $3,000 for product seeding, and $2,000 for Instagram ads."
1.0,Young adults (18-25) interested in eco-friendly living,Website Traffic,"Allocate $300 for influencer collaborations, $200 for sponsored ads, and $500 for content creation","Launch a 6-week social media campaign across Instagram, TikTok, and Facebook, focusing on user-generated content and influencer partnerships. Allocate $300 for influencer collaborations, $200 for sponsored ads, and $500 for content creation. Utilize hashtags #SustainableFashion and #EcoFriendly to increase discoverability."
5.0,Gen Z (18-24 years old),Brand Awareness,"Allocate $2,000 for influencer fees, $1,500 for paid social media ads, and $1,500 for content creation","Launch a social media contest, ""Verdi Vibes,"" where followers share eco-friendly fashion tips using a branded hashtag. Partner with 5 eco-influencers to showcase Verdi's sustainable clothing. Allocate $2,000 for influencer fees, $1,500 for paid social media ads, and $1,500 for content creation. Utilize Instagram Reels and TikTok for engaging, short-form content."
20.0,Gen Z (18-24 years old); Constraints: Limited budget; Goals: Increase brand awareness by 20% in 3 months; Workflow Stage: Strategy.,Brand Awareness,"Allocate $1,000 for influencer partnerships and $1,500 for targeted ads","""Verde Vibes"" campaign: Utilize Instagram Reels and TikTok to create engaging, eco-friendly content. Collaborate with 5 eco-influencers to showcase Verde's sustainable fashion practices. Allocate $1,000 for influencer partnerships and $1,500 for targeted ads. Monitor and adjust campaign performance using Instagram Insights and TikTok Analytics."
50.0,Foodies and busy professionals; Constraints: Limited content creation resources; Goals: Boost engagement by 50% in 2 months; Workflow Stage: Post Scheduling.,Engagement,Allocate 30 minutes weekly for content creation and curation,"""Tasty Tuesdays"" and ""Foodie Fridays"" series: Develop a content calendar featuring visually appealing food images, customer testimonials, and behind-the-scenes stories. Utilize Hootsuite to schedule posts in advance, ensuring consistent posting and minimizing content gaps. Allocate 30 minutes weekly for content creation and curation."
5.0,"Gen Z (18-24 years old); Constraints: Limited budget ($5,000); Goals: Increase brand awareness by 30% and drive sales by 20% within 6 weeks; Workflow Stage: Strategy and Content Creation.",Brand Awareness,"Allocate $2,000 for influencer partnerships, $1,500 for sponsored ads, and $1,500 for content creation","Develop a social media campaign, ""Verde Vibes,"" focusing on Instagram and TikTok. Collaborate with 5 eco-conscious influencers to showcase Verde's sustainable clothing. Utilize Instagram Reels and TikTok for behind-the-scenes content, highlighting the brand's commitment to sustainability. Allocate $2,000 for influencer partnerships, $1,500 for sponsored ads, and $1,500 for content creation. Monitor engagement and adjust the campaign using AI-powered analytics tools."
3.0,IT Decision-Makers; Constraints: 3-week timeline; Goals: Nurture 500 leads and convert 10% into paying customers; Workflow Stage: Email Copywriting and Automation.,Lead Generation,"Allocate 1 week for email copywriting, 1 week for automation setup, and 1 week for campaign launch and monitoring","Create a 3-email sequence: ""Expert Insights,"" ""Success Stories,"" and ""Exclusive Offer."" Use AI-driven personalization to tailor content based on lead behavior and interests. Include a webinar invitation in the second email, showcasing TechCorp's thought leadership. Use marketing automation tools to track engagement and trigger follow-up emails. Allocate 1 week for email copywriting, 1 week for automation setup, and 1 week for campaign launch and monitoring."
2.0,Health-Conscious Individuals (25-45 years old); Constraints: Limited resources (2-person team); Goals: Publish 2 high-quality blog posts per week and increase website traffic by 50% within 3 months; Workflow Stage: Content Creation and Planning.,Website Traffic,"Allocate 1 day per week for content creation, 1 day for review and editing, and 1 day for publishing and promotion","Implement a content calendar focusing on holistic wellness, mindfulness, and self-care. Utilize AI-assisted content generation tools to research and outline topics. Collaborate with guest bloggers and wellness experts to expand the center's network. Allocate 1 day per week for content creation, 1 day for review and editing, and 1 day for publishing and promotion. Monitor analytics to refine the"
5.0,Millennials (18-35) interested in sustainability,Website Traffic,"Allocate $1,500 for influencer partnerships and $1,000 for sponsored ads","""Green Revolution"" campaign: Collaborate with 5 eco-influencers to showcase our sustainable clothing line. Utilize Instagram Reels and TikTok to share engaging, educational content highlighting the brand's commitment to reducing waste and carbon footprint. Allocate $1,500 for influencer partnerships and $1,000 for sponsored ads. Create a branded hashtag and encourage user-generated content."
10.0,Gen Z consumers aged 18-24.,Brand Awareness,"Allocate $3,000 for influencer partnerships, $4,000 for content creation, and $3,000 for paid advertising","Launch a social media contest, ""Verde Vibes,"" where followers share their eco-friendly fashion tips using a branded hashtag. Partner with 5 eco-influencers to showcase the new line. Utilize Instagram Reels and TikTok for engaging, short-form content. Allocate $3,000 for influencer partnerships, $4,000 for content creation, and $3,000 for paid advertising."
20.0,"Gen Z (18-24), Constraints: Limited budget, Goals: Increase brand awareness by 20% in 3 months, Workflow Stage: Strategy.",Brand Awareness,"Allocate $1,000 for influencer partnerships and $500 for ad spend","Develop an influencer marketing campaign partnering with eco-conscious Gen Z influencers to showcase Verde Fashion's sustainable clothing lines. Utilize Instagram Reels and TikTok to create engaging, short-form content highlighting the brand's commitment to sustainability. Allocate $1,000 for influencer partnerships and $500 for ad spend."
5.0,Gen Z (18-24 years old),Brand Awareness,"Allocate $2,000 for influencer fees, $1,500 for content creation, and $1,500 for paid advertising","Develop a social media campaign leveraging Instagram Reels and TikTok, focusing on eco-friendly fashion tips, behind-the-scenes content, and user-generated content. Partner with 5 eco-influencers to showcase GreenThreads' products. Allocate $2,000 for influencer fees, $1,500 for content creation, and $1,500 for paid advertising."
1.0,Young adults (18-30) interested in eco-friendly living,Brand Awareness,"Allocate $300 for influencer partnerships, $200 for content creation, and $500 for paid social media ads","Launch a social media contest, ""Eco-Chic Challenge,"" where followers share their favorite eco-friendly fashion tips and tricks. Partner with 5 eco-influencers to promote the contest and brand. Utilize Instagram Reels and TikTok for engaging, short-form content. Allocate $300 for influencer partnerships, $200 for content creation, and $500 for paid social media ads."
10.0,"Gen Z (18-24); Constraints: Limited budget ($10,000); Goals: Increase brand awareness, drive website traffic; Workflow Stage: Strategy",Brand Awareness,"Allocate $3,000 for influencer fees, $4,000 for content creation, and $3,000 for ad spend","""GreenThreads Launch Campaign"": Utilize Instagram Reels and TikTok to showcase eco-friendly clothing lines, partnering with 5 social media influencers for sponsored content. Allocate $3,000 for influencer fees, $4,000 for content creation, and $3,000 for ad spend. Create a branded hashtag #GreenThreadsRevolution, encouraging users to share their own eco-friendly fashion choices."
20.0,"Gamers and esports enthusiasts (18-35); Constraints: Limited budget ($20,000); Goals: Increase brand awareness, drive sales; Workflow Stage: Influencer Research",Brand Awareness,"Allocate $10,000 for influencer fees, $5,000 for content creation, and $5,000","""Energee Gaming Squad"": Partner with 5 gaming influencers (combined 1 million followers) for sponsored content, product placements, and giveaways. Allocate $10,000 for influencer fees, $5,000 for content creation, and $5,000"
5.0,"Fashion-conscious millennials and Gen Z; Constraints: Limited budget of $5,000; Goals: 20% increase in website traffic and 15% increase in brand mentions on social media within 6 weeks; Workflow Stage: Strategy",Website Traffic,"Allocate $2,000 for influencer partnerships, $1,500 for sponsored ads, and $1,500 for content creation","Develop a social media campaign, ""Wear Your Values,"" focusing on Instagram and TikTok. Partner with 5 eco-influencers to showcase sustainable fashion practices, and encourage users to share their own eco-friendly fashion choices using a branded hashtag. Allocate $2,000 for influencer partnerships, $1,500 for sponsored ads, and $1,500 for content creation."
6.0,"Young adults aged 18-30 who prioritize eco-friendliness. Constraints: Limited budget, 6-week timeline. Goals: Increase followers by 500%, boost website traffic by 200%. Workflow Stage: Strategy.",Website Traffic,"Allocate $1,500 for targeted ads","Develop a social media campaign focusing on Instagram and TikTok, leveraging hashtags #ecofashion and #sustainability. Collaborate with 5 eco-influencers for sponsored content, and create engaging, educational posts highlighting GreenThreads' sustainable practices. Allocate $1,500 for targeted ads."
1.0,"Young adults aged 18-30, environmentally conscious",Website Traffic,"Allocate $300 for influencer collaborations, $200 for paid ads, and $500 for content creation","Develop a 3-month social media strategy focusing on Instagram and TikTok. Utilize hashtags #ecofriendly and #sustainability, and partner with 3 eco-influencers for sponsored content. Allocate $300 for influencer collaborations, $200 for paid ads, and $500 for content creation. Share engaging content (images, videos, and stories) highlighting the brand's commitment to sustainability, customer testimonials, and behind-the-scenes insights into the design process."
10.0,"Young adults (18-30) interested in sustainability and fashion. Constraints: Limited budget of $10,000. Goals: Increase brand awareness by 20% and drive sales by 15% within 6 weeks. Workflow Stage: Strategy.",Brand Awareness,"Allocate $3,000 for influencer collaborations, $2,000 for paid social media ads, and $5,000 for content creation and contest prizes","Launch a social media contest, ""Eco-Chic Challenge,"" where followers share their sustainable fashion choices using a branded hashtag. Partner with eco-influencers to showcase GreenThreads' products. Utilize Instagram Reels and TikTok for engaging, short-form content. Allocate $3,000 for influencer collaborations, $2,000 for paid social media ads, and $5,000 for content creation and contest prizes."
50.0,"Gamers and esports enthusiasts (18-35). Constraints: Budget of $50,000. Goals: Increase brand awareness by 30% and drive sales by 20% within 8 weeks. Workflow Stage: Image Generation.",Brand Awareness,"Allocate $20,000 for influencer fees, $15,000 for content creation, and $15,000 for product seeding and events","Partner with 5 gaming influencers on Twitch and YouTube to showcase GameFuel as their go-to energy drink. Create sponsored content, such as gaming sessions and product reviews, featuring custom-designed GameFuel branding and packaging. Allocate $20,000 for influencer fees, $15,000 for content creation, and $15,000 for product seeding and events."
30.0,"Gen Z (18-24), Constraints: Limited budget, Goals: Increase brand awareness by 30% in 6 weeks, Workflow Stage: Strategy",Brand Awareness,"Allocate $1,000 for influencer partnerships and $500 for ad spend","Develop a social media campaign, ""Threads for a Cause,"" highlighting eco-friendly fashion practices. Utilize Instagram Reels and TikTok to share engaging, informative content, and collaborate with 5 eco-influencers to showcase sustainable fashion tips. Allocate $1,000 for influencer partnerships and $500 for ad spend."
1.0,Young adults aged 18-25,Brand Awareness,"Allocate $300 for influencer collaborations, $200 for sponsored content, and $500 for a social media contest where followers can share their own sustainable fashion tips","Create a social media campaign, ""Wear Your Values,"" highlighting Verde's eco-friendly practices and encouraging users to share their own sustainable fashion choices. Utilize Instagram Reels and TikTok for short-form content, partnering with 3 eco-influencers to showcase Verde's clothing. Allocate $300 for influencer collaborations, $200 for sponsored content, and $500 for a social media contest where followers can share their own sustainable fashion tips."
5.0,Environmentally conscious fashion enthusiasts aged 18-35.,Brand Awareness,"Allocate $2,000 for influencer partnerships, $1,500 for content creation, and $1,500 for paid social media ads","Launch a social media campaign, ""Wear Your Values,"" highlighting GreenThreads' commitment to sustainability. Create engaging content (images, videos, and Reels) showcasing eco-friendly materials, production processes, and customer testimonials. Utilize Instagram, TikTok, and Facebook to reach the target audience. Collaborate with eco-influencers and user-generated content campaigns to amplify the brand's message. Allocate $2,000 for influencer partnerships, $1,500 for content creation, and $1,500 for paid social media ads."
3.0,18-24-year-olds interested in eco-friendly fashion,Sales,"Allocate $5,000 for influencer partnerships and $2,000 for sponsored ads","Develop a 3-month social media campaign focusing on Instagram, TikTok, and Twitter. Collaborate with eco-conscious influencers to showcase GreenThreads' sustainable fashion lines. Utilize hashtags #Sustainability #EcoFashion #GenZ, and create engaging, educational content highlighting the brand's commitment to reducing waste and carbon footprint. Allocate $5,000 for influencer partnerships and $2,000 for sponsored ads."
