Budget Constraints,Target Audience,Goals,Allocated Budget Distribution,Response Text
1.0,"Environmentally conscious women aged 25-45; Constraints: Limited budget of $1,000; Goals: Increase social media followers, drive website traffic; Workflow Stage: Strategy",Website Traffic,Allocate $500 for influencer partnerships and $500 for sponsored ads targeting the identified audience,"Create a ""Eco-Challenge"" social media campaign, where followers are encouraged to share their own eco-friendly fashion tips and tricks using a branded hashtag. Collaborate with 5 eco-influencers to promote the challenge and share engaging content. Allocate $500 for influencer partnerships and $500 for sponsored ads targeting the identified audience."
5.0,"18-30-year-olds, environmentally conscious, active on Instagram and TikTok.",Brand Awareness,"Allocate $2,000 for influencer collaborations, $1,500 for UGC content creation, and $1,500 for paid social media ads targeting the identified audience","""EarthRevival"" campaign: Partner with eco-influencers and user-generated content (UGC) creators to showcase GreenThreads' sustainable clothing in relatable, everyday settings. Utilize Instagram Reels and TikTok for engaging, 60-second ""before-and-after"" style transformations, highlighting the brand's eco-friendly materials and production methods. Allocate $2,000 for influencer collaborations, $1,500 for UGC content creation, and $1,500 for paid social media ads targeting the identified audience."
5.0,"Gen Z (18-24 years old); Constraints: Limited budget of $5,000; Goals: Increase followers by 20% and drive website traffic by 15%; Workflow Stage: Strategy.",Website Traffic,"Allocate $2,000 for influencer partnerships, $1,500 for content creation, and $1,500 for paid advertising","Create a 6-week campaign, ""Verde Vibes,"" focusing on Instagram and TikTok. Week 1-2: Share engaging, eco-friendly fashion tips and behind-the-scenes content. Week 3-4: Collaborate with 3 eco-influencers for sponsored content. Week 5-6: Launch a hashtag challenge, encouraging users to share their own sustainable fashion choices. Allocate $2,000 for influencer partnerships, $1,500 for content creation, and $1,500 for paid advertising."
20.0,"Environmentally conscious millennials; Constraints: Limited budget; Goals: Increase brand awareness by 20%, drive sales by 15%; Workflow Stage: Strategy.",Brand Awareness,"Allocate $500 for influencer partnerships and $1,000 for targeted ads","Develop a social media campaign featuring eco-friendly influencers showcasing Verde Clothing's products. Utilize Instagram Reels and TikTok to share behind-the-scenes content, sustainable fashion tips, and user-generated content. Allocate $500 for influencer partnerships and $1,000 for targeted ads."
5.0,Gen Z consumers (18-24 years old) who prioritize environmental sustainability.,Website Traffic,"Allocate $1,500 for influencer partnerships, $1,000 for AI-generated content, and $2,500 for targeted social media ads","Launch a ""Green Revolution"" campaign across Instagram, TikTok, and Twitter. Collaborate with eco-influencers to showcase Verde's sustainable production processes. Utilize AI-generated visuals highlighting eco-friendly materials and supply chains. Schedule weekly Instagram Live sessions discussing sustainable fashion tips and behind-the-scenes content. Allocate $1,500 for influencer partnerships, $1,000 for AI-generated content, and $2,500 for targeted social media ads."
20.0,"Environmentally conscious millennials, Constraints: Limited budget, Goals: Increase website traffic by 20% in 3 months, Workflow Stage: Strategy",Website Traffic,"Allocate $1,000 for sponsored ads targeting environmentally conscious millennials","Launch a social media contest, ""Eco-Chic Challenge,"" where followers share their sustainable fashion tips and tricks using a branded hashtag. Partner with eco-influencers to amplify the reach and offer a discount code to participants who share their posts. Allocate $1,000 for sponsored ads targeting environmentally conscious millennials."
5.0,"Fashion-conscious young adults (18-30); Constraints: Limited budget of $5,000; Goals: Increase brand awareness by 20%, drive sales by 15%; Workflow Stage: Strategy",Brand Awareness,"Allocate $2,000 for influencer partnerships, $1,500 for sponsored ads, and $1,500 for content creation","Develop a 3-month campaign focusing on Instagram and TikTok, utilizing eco-friendly influencers, user-generated content, and sponsored ads highlighting GreenThreads' commitment to sustainability. Allocate $2,000 for influencer partnerships, $1,500 for sponsored ads, and $1,500 for content creation. Utilize relevant hashtags, collaborate with 5 eco-conscious influencers, and share customer testimonials to create engaging content."
5.0,Young adults (18-30) interested in eco-friendly living,Brand Awareness,"Allocate $2,000 for influencer collaborations, $1,500 for paid social media ads, and $1,500 for content creation","Launch a social media contest, ""Eco-Chic Challenge,"" where followers share their own sustainable fashion tips and tricks using a branded hashtag. Partner with eco-influencers to amplify the campaign. Allocate $2,000 for influencer collaborations, $1,500 for paid social media ads, and $1,500 for content creation. Track engagement and adjust the campaign strategy using AI-powered analytics."
1.0,"Millennials aged 25-35, fashion-conscious, and environmentally aware",Website Traffic,"Allocate $300 for influencer partnerships, $200 for content creation, and $500 for targeted ads","Develop a #SustainableFashionChallenge, encouraging users to share eco-friendly fashion tips, tricks, and favorite Green Threads pieces on Instagram and TikTok. Collaborate with 3 eco-influencers for sponsored content, and offer a 15% discount to participants who use a branded hashtag. Allocate $300 for influencer partnerships, $200 for content creation, and $500 for targeted ads."
5.0,Gen Z consumers (18-24 years old) who prioritize sustainability and social responsibility.,Brand Awareness,"Allocate $2,000 for sponsored posts and $1,500 for influencer collaborations","Develop a social media campaign, ""Verde Vibes,"" that showcases the brand's commitment to sustainability through engaging visuals and influencer partnerships. Allocate $2,000 for sponsored posts and $1,500 for influencer collaborations. Utilize Instagram Reels and TikTok to share behind-the-scenes content, customer testimonials, and eco-friendly fashion tips. Partner with 3 social media influencers who align with the brand's values and have a combined following of 1 million. Monitor engagement metrics and adjust the campaign strategy accordingly."
1.0,Gen Z consumers (18-24 years old),Brand Awareness,"Allocate $300 for influencer collaborations, $200 for content creation, and $500 for paid social media ads targeting Gen Z consumers","Develop a social media campaign, ""Sustainable Style Challenge,"" where influencers and followers are encouraged to share their eco-friendly fashion choices using a branded hashtag. Partner with 5 micro-influencers to showcase Green Threads' clothing and create engaging content (images, videos, and Reels). Allocate $300 for influencer collaborations, $200 for content creation, and $500 for paid social media ads targeting Gen Z consumers."
10.0,Gen Z and millennials concerned about environmental impact.,Website Traffic,"Allocate $3,000 for influencer fees, $4,000 for ad spend, and $3,000 for content creation","Develop an Instagram-centric campaign focusing on user-generated content (UGC) and influencer partnerships. Collaborate with 5 eco-conscious influencers for sponsored posts, and launch a hashtag challenge encouraging customers to share their sustainable fashion choices. Allocate $3,000 for influencer fees, $4,000 for ad spend, and $3,000 for content creation. Utilize Instagram's shopping feature to drive website traffic."
1.0,Young adults aged 18-30.,Engagement,"Allocate $300 for influencer partnerships, $200 for content creation, and $500 for paid advertising","Develop a social media campaign, ""Green Heroes,"" leveraging Instagram Reels and TikTok to showcase the benefits of sustainable living. Collaborate with eco-influencers to promote products and encourage user-generated content. Allocate $300 for influencer partnerships, $200 for content creation, and $500 for paid advertising."
5.0,Gen Z (18-24 years old),Brand Awareness,"Allocate $1,500 for influencer partnerships, $1,000 for paid social media ads, and $2,500 for content creation","Create a social media campaign titled ""EcoWarrior Challenge"" that encourages users to share their sustainable fashion choices on Instagram, TikTok, and Twitter. Collaborate with 5 eco-influencers to showcase EcoCycle's clothing lines and promote the challenge. Utilize relevant hashtags and tag relevant eco-friendly brands to increase reach. Allocate $1,500 for influencer partnerships, $1,000 for paid social media ads, and $2,500 for content creation."
20.0,"18-30-year-old environmentally conscious consumers; Constraints: Limited budget, high competition; Goals: Increase brand awareness by 20%, drive website traffic by 15%; Workflow Stage: Strategy.",Brand Awareness,"Allocate $1,500 for influencer collaborations and $1,000 for sponsored content","Develop an influencer marketing campaign partnering with eco-friendly lifestyle influencers on Instagram and TikTok. Utilize relevant hashtags and create engaging, informative content highlighting GreenThreads' sustainable materials, production processes, and commitment to reducing waste. Allocate $1,500 for influencer collaborations and $1,000 for sponsored content."
10.0,"18-30-year-olds; Constraints: Limited budget of $10,000; Goals: Increase brand awareness by 30%, drive website traffic by 25%; Workflow Stage: Social Media Strategy.",Brand Awareness,"Allocate $5,000 for influencer partnerships, $3,000 for content creation, and $2,000 for paid advertising","""Threads for a Greener Tomorrow"" campaign, focusing on Instagram and TikTok, featuring eco-friendly fashion influencers showcasing GreenThreads' products, user-generated content, and interactive polls/quizzes highlighting sustainable fashion practices. Utilize Instagram Reels and TikTok's ""Reaction"" feature to boost engagement. Allocate $5,000 for influencer partnerships, $3,000 for content creation, and $2,000 for paid advertising."
